{"assertions":{"cache_rebuild_isolated":true,"config_root_cwd_swaps_rejected":true,"copied_and_swapped_discovery_token_rejected":true,"editor_restart_isolated":true,"foreign_ids_rejected":true,"isolation_matrix_complete":true,"no_cross_project_leakage":true,"package_version_mismatch_rejected":true,"readback_and_targeted_undo":true,"separate_action_only_approvals":true,"source_unchanged":true,"target_fault_isolated":true,"two_package_sidecars":true,"two_real_editors":true,"validation_reports_isolated":true},"bindings":{"godot_artifact_sha256":"sha256:157a265d49f72c0b6974340046379549ad74aab6e5a70e3cc6e239bf6be7102e","godot_commit":"506f7f084c0bfd62a78788b6b947e1142eaafed5","godot_version":"4.8.dev.codex.506f7f084","package_archive_sha256":"sha256:b721c6c45eb6abb8f77b4a1c942ac46315a249b73b884b2da3dd080f8a22dbc9","package_build_provenance_sha256":"sha256:e0fed1d5184c435826c5a3f8a8ea2782153442bd7971b62da57ab0fbc0b1eb9f","package_manifest_sha256":"sha256:32c55920ac7740d7ef8a6691cb52a55c9dcd250348e11336d65241f40049e9fc","package_sidecar_path":"bin/godot-codex-mcp","package_sidecar_sha256":"sha256:a37bd081d3f52c5cb09b232831e091b516d67963e9e4ba95f6845860730c1e49","package_source_commit":"93221f195f0c4719a89c3804e4885c09009f57f6","package_version":"0.1.0","registry_sha256":"sha256:64c88e2b4af25619178a836a9b74699b3112e83fb002a25d4a2900d894dd1f5d"},"capture_kind":"real_package_multi_project","cleanup":{"editor_processes_stopped":true,"game_processes_stopped":true,"sidecar_processes_stopped":true,"temporary_workspaces_removed":true},"command":{"argv_template":["{python}","-E","-s","-S","tests/codex/sprint11_multi_project.py","--godot","{godot}","--sidecar","{package_sidecar}","--package-operations","{package_operations}","--package-data-root","{package_data_root}","--expected-sidecar-sha256","{package_sidecar_sha256}","--expected-package-version","{package_version}","--timeout","{timeout}","--report","{report}"],"command_sha256":"sha256:6b85871a2deee36d8b9e09cfc8ca33c2ce19882a91d4302198e353b02fe8fafa","cwd":".","duration_ms":48060,"exit_code":0,"id":"multi_project_live","report_path":"tests/codex/acquisition/sprint11/multi-project/report.json","report_sha256":"sha256:5cea848480acd7a7a28bf74a8f6a048f8f33a22e971b87a0197102b8ccf747a6","runner_path":"tests/codex/sprint11_multi_project.py","runner_sha256":"sha256:0e80acbe6c26bd2c2b0811707bde18d4fcb65ac1de399736d0247e63561c7cd5","stderr_sha256":"sha256:e3b0c44298fc1c149afbf4c8996fb92427ae41e4649b934ca495991b7852b855","stdout_sha256":"sha256:5cea848480acd7a7a28bf74a8f6a048f8f33a22e971b87a0197102b8ccf747a6"},"fixtures":[{"path":"tests/codex/fixtures/transaction_oracle/golden-transactions.json","sha256":"sha256:9dd9725d5c668ae7e126c45a54c0e8ab9f55856abb24c4dc96a8f4ed90c48c58"},{"path":"tests/codex/fixtures/transaction_prepare_project/.gitignore","sha256":"sha256:531d0d253cec1addb97b2cb2d144b6589ff934513eb9c9b8cf882cb49e4c0c32"},{"path":"tests/codex/fixtures/transaction_prepare_project/addons/codex_s9_prepare/codex_s9_prepare.gd","sha256":"sha256:a2551005c89e8209f0c324bff890aee89a4472573b47ea076ec019de3271914d"},{"path":"tests/codex/fixtures/transaction_prepare_project/addons/codex_s9_prepare/codex_s9_prepare.gd.uid","sha256":"sha256:09cc0d1c4d76c69c538cab7c5e40c6ea29a96116f3b1d97b0a8663a89ffe7b8b"},{"path":"tests/codex/fixtures/transaction_prepare_project/addons/codex_s9_prepare/plugin.cfg","sha256":"sha256:ae38dc076edfb3c28c54f79580efe67279f3ab54c7f8f8bec2c6ce25dce428f0"},{"path":"tests/codex/fixtures/transaction_prepare_project/inherited_base.tscn","sha256":"sha256:50c1089e695c72dfe948f43e05d1c55ca089412126ebda9c7a7e14d41e66d0b7"},{"path":"tests/codex/fixtures/transaction_prepare_project/inherited_variant.tscn","sha256":"sha256:520d156055a2eb1e149e61160270d4ebf7b0383ed8911ac8c06c5d68c5fac24b"},{"path":"tests/codex/fixtures/transaction_prepare_project/instance_source.tscn","sha256":"sha256:bb056e0b07ae06bc8c41a956e61f0c585faae54bc249898fa7642863a4ee6579"},{"path":"tests/codex/fixtures/transaction_prepare_project/main.tscn","sha256":"sha256:8e7cdcc4f3e4efee66151cfa4714de97ea7f61f06d31f27152cbea6ed84693fd"},{"path":"tests/codex/fixtures/transaction_prepare_project/project.godot","sha256":"sha256:099944c6f225634575ecd26b55d85b76718e0af0f2f0f0662d5af97ed033566d"},{"path":"tests/codex/fixtures/transaction_prepare_project/scripts/fixture_endpoint.gd","sha256":"sha256:15a8e8a918b97dde3c339c870bb6f531b6daca33e00d26d1027e5740f91a9851"},{"path":"tests/codex/fixtures/transaction_prepare_project/scripts/fixture_endpoint.gd.uid","sha256":"sha256:eadec58e3be20b4aad09034a2fbc5b7b006fc4cd0aac8b35ea3e53f691c912ed"},{"path":"tests/codex/fixtures/transaction_prepare_project/scripts/incompatible.gd","sha256":"sha256:087d184f7cbac52200b4c44963fffd5ead7b411dd4e1b0dcfd5a71344d8cd442"},{"path":"tests/codex/fixtures/transaction_prepare_project/scripts/incompatible.gd.uid","sha256":"sha256:50bf542d0878ab82b4d2405e15a401a7bb504b05bfa3f7e832df595fc0beb543"},{"path":"tests/codex/fixtures/transaction_prepare_project/scripts/replacement_endpoint.gd","sha256":"sha256:f734cc47a76a331c2a9d4a01c4877948a4a9d367edf9f40d158db366530ad23f"}],"redaction":{"absolute_paths_absent":true,"native_ids_absent":true,"secrets_absent":true,"source_content_absent":true},"schema_version":"s11-multi-project-receipt/1.0","status":"passed"}
